item,itemLabel,startDate,endDate,sourceDate,psid
Q167846,Zayed bin Sultan Al Nahyan,1971-12-02,2004-11-02,,Q167846-E00B35E2-8669-4C40-8317-3E08F4812A10
Q215477,Maktoum bin Rashid Al Maktoum,2004-11-02,2004-11-03,,Q215477-66C20358-81C3-4D4C-A92E-1F3D9AFF3FFC
Q1059948,Khalifa bin Zayed Al Nahyan,2004-11-03,2022-05-13,,q1059948-9EC9EC97-4483-44AF-9125-9E069E914E6D
Q57655,Mohammed bin Rashid Al Maktoum,2022-05-13,2022-05-14,,Q57655-45fc69ea-4cb1-a450-59e2-683aa852f627
Q1951896,Mohamed bin Zayed Al Nahyan,2022-05-14,,2022-05-28,Q1951896-2BC1DA09-B3B3-4F9C-B17A-B8D900994889
